{"schema_version":"gocode.rc0.post-rc0-adjunct-trust-schema-registry/2","repository_id":"gocode","registry_revision":1,"project_owner_authority_receipt_sha256":"aaaaaaaaaaaaaaaaaaaaaaaaaaaaaaaaaaaaaaaaaaaaaaaaaaaaaaaaaaaaaaaa","adjunct_trust_schema_registry_envelope_sha256":"1111111111111111111111111111111111111111111111111111111111111111","adjunct_schema_digests":[{"schema_id":"gocode.rc0.platform-scope-mapping-policy/2","schema_sha256":"c82fb0198609c8219bba78bca5a78e59d347f21768523895dc88f363229b6fc4"},{"schema_id":"gocode.rc0.policy-activation-intent/2","schema_sha256":"bd19163d6f298ea51d68f154e5d3f3c9f42b5a53df812d069c42c736a7563351"},{"schema_id":"gocode.rc0.policy-activation-snapshot/2","schema_sha256":"c8687989b8aa57ad78e4fe426fdda2b58bfe5a30cdecffca900f3e64dc617d65"},{"schema_id":"gocode.rc0.platform-qualified-subject/2","schema_sha256":"8271f511976bb96fecc38c72037edb342704824d00cf799f748342fc6ef28703"},{"schema_id":"gocode.release.platform-qualification-matrix/3","schema_sha256":"b9599091b406a7934c1e4b4b7bb6e3b05d05ad21083b938713912f8594babb26"}]}
